[{"alternative_source_search_id":null,"artwork_id":"artwork:aic-111442","branch_id":"art","byte_record_id":null,"cross_check_id":"media-cross-check:aic-111442","data_version":"1.0.0","decided_at":"2026-07-15T00:03:58Z","decision":"blocked_source_unavailable","decision_reason_codes":["media_http_status"],"derivative_ids":[],"entity_type":"media_automated_review","executor":"automated_cross_validation_pipeline","human_review_dependency":false,"id":"media-review:aic-111442","mandatory_closure":{"bytes":"fail","identity":"pass","quality":"not_applicable","rights":"pass"},"phase_id":"MUSEUM-03C","quality_assessment_id":null,"schema_version":"1.0.0"},{"alternative_source_search_id":null,"artwork_id":"artwork:aic-13506","branch_id":"art","byte_record_id":null,"cross_check_id":"media-cross-check:aic-13506","data_version":"1.0.0","decided_at":"2026-07-15T00:03:58Z","decision":"blocked_source_unavailable","decision_reason_codes":["media_http_status"],"derivative_ids":[],"entity_type":"media_automated_review","executor":"automated_cross_validation_pipeline","human_review_dependency":false,"id":"media-review:aic-13506","mandatory_closure":{"bytes":"fail","identity":"pass","quality":"not_applicable","rights":"pass"},"phase_id":"MUSEUM-03C","quality_assessment_id":null,"schema_version":"1.0.0"},{"alternative_source_search_id":"alternative-search:aic-158971","artwork_id":"artwork:aic-158971","branch_id":"art","byte_record_id":null,"cross_check_id":"media-cross-check:aic-158971","data_version":"1.0.0","decided_at":"2026-07-15T00:03:58Z","decision":"blocked_rights_conflict","decision_reason_codes":["object_level_rights_conflict"],"derivative_ids":[],"entity_type":"media_automated_review","executor":"automated_cross_validation_pipeline","human_review_dependency":false,"id":"media-review:aic-158971","mandatory_closure":{"bytes":"not_applicable","identity":"pass","quality":"not_applicable","rights":"fail"},"phase_id":"MUSEUM-03C","quality_assessment_id":null,"schema_version":"1.0.0"},{"alternative_source_search_id":null,"artwork_id":"artwork:aic-26650","branch_id":"art","byte_record_id":null,"cross_check_id":"media-cross-check:aic-26650","data_version":"1.0.0","decided_at":"2026-07-15T00:03:58Z","decision":"blocked_source_unavailable","decision_reason_codes":["media_http_status"],"derivative_ids":[],"entity_type":"media_automated_review","executor":"automated_cross_validation_pipeline","human_review_dependency":false,"id":"media-review:aic-26650","mandatory_closure":{"bytes":"fail","identity":"pass","quality":"not_applicable","rights":"pass"},"phase_id":"MUSEUM-03C","quality_assessment_id":null,"schema_version":"1.0.0"},{"alternative_source_search_id":null,"artwork_id":"artwork:aic-28826","branch_id":"art","byte_record_id":null,"cross_check_id":"media-cross-check:aic-28826","data_version":"1.0.0","decided_at":"2026-07-15T00:03:58Z","decision":"blocked_source_unavailable","decision_reason_codes":["media_http_status"],"derivative_ids":[],"entity_type":"media_automated_review","executor":"automated_cross_validation_pipeline","human_review_dependency":false,"id":"media-review:aic-28826","mandatory_closure":{"bytes":"fail","identity":"pass","quality":"not_applicable","rights":"pass"},"phase_id":"MUSEUM-03C","quality_assessment_id":null,"schema_version":"1.0.0"},{"alternative_source_search_id":"alternative-search:aic-60513","artwork_id":"artwork:aic-60513","branch_id":"art","byte_record_id":null,"cross_check_id":"media-cross-check:aic-60513","data_version":"1.0.0","decided_at":"2026-07-15T00:03:58Z","decision":"blocked_rights_conflict","decision_reason_codes":["object_level_rights_conflict"],"derivative_ids":[],"entity_type":"media_automated_review","executor":"automated_cross_validation_pipeline","human_review_dependency":false,"id":"media-review:aic-60513","mandatory_closure":{"bytes":"not_applicable","identity":"pass","quality":"not_applicable","rights":"fail"},"phase_id":"MUSEUM-03C","quality_assessment_id":null,"schema_version":"1.0.0"},{"alternative_source_search_id":"alternative-search:met-12774","artwork_id":"artwork:met-12774","branch_id":"art","byte_record_id":null,"cross_check_id":"media-cross-check:met-12774","data_version":"1.0.0","decided_at":"2026-07-15T00:03:58Z","decision":"metadata_only_after_automated_review","decision_reason_codes":["no_approved_media_after_alternative_search"],"derivative_ids":[],"entity_type":"media_automated_review","executor":"automated_cross_validation_pipeline","human_review_dependency":false,"id":"media-review:met-12774","mandatory_closure":{"bytes":"not_applicable","identity":"pass","quality":"not_applicable","rights":"fail"},"phase_id":"MUSEUM-03C","quality_assessment_id":null,"schema_version":"1.0.0"},{"alternative_source_search_id":"alternative-search:met-16947","artwork_id":"artwork:met-16947","branch_id":"art","byte_record_id":null,"cross_check_id":"media-cross-check:met-16947","data_version":"1.0.0","decided_at":"2026-07-15T00:03:58Z","decision":"metadata_only_after_automated_review","decision_reason_codes":["no_approved_media_after_alternative_search"],"derivative_ids":[],"entity_type":"media_automated_review","executor":"automated_cross_validation_pipeline","human_review_dependency":false,"id":"media-review:met-16947","mandatory_closure":{"bytes":"not_applicable","identity":"pass","quality":"not_applicable","rights":"fail"},"phase_id":"MUSEUM-03C","quality_assessment_id":null,"schema_version":"1.0.0"},{"alternative_source_search_id":"alternative-search:met-17016","artwork_id":"artwork:met-17016","branch_id":"art","byte_record_id":null,"cross_check_id":"media-cross-check:met-17016","data_version":"1.0.0","decided_at":"2026-07-15T00:03:58Z","decision":"metadata_only_after_automated_review","decision_reason_codes":["no_approved_media_after_alternative_search"],"derivative_ids":[],"entity_type":"media_automated_review","executor":"automated_cross_validation_pipeline","human_review_dependency":false,"id":"media-review:met-17016","mandatory_closure":{"bytes":"not_applicable","identity":"pass","quality":"not_applicable","rights":"fail"},"phase_id":"MUSEUM-03C","quality_assessment_id":null,"schema_version":"1.0.0"},{"alternative_source_search_id":null,"artwork_id":"artwork:met-267426","branch_id":"art","byte_record_id":"media-byte:met-267426","cross_check_id":"media-cross-check:met-267426","data_version":"1.0.0","decided_at":"2026-07-15T00:03:58Z","decision":"approved_self_hosted","decision_reason_codes":["identity_rights_bytes_quality_closed"],"derivative_ids":["media-derivative:met-267426-320w-jpeg","media-derivative:met-267426-320w-webp","media-derivative:met-267426-640w-jpeg","media-derivative:met-267426-640w-webp","media-derivative:met-267426-960w-jpeg","media-derivative:met-267426-960w-webp","media-derivative:met-267426-1600w-jpeg","media-derivative:met-267426-1600w-webp"],"entity_type":"media_automated_review","executor":"automated_cross_validation_pipeline","human_review_dependency":false,"id":"media-review:met-267426","mandatory_closure":{"bytes":"pass","identity":"pass","quality":"pass","rights":"pass"},"phase_id":"MUSEUM-03C","quality_assessment_id":"media-quality:met-267426","schema_version":"1.0.0"},{"alternative_source_search_id":null,"artwork_id":"artwork:met-268690","branch_id":"art","byte_record_id":"media-byte:met-268690","cross_check_id":"media-cross-check:met-268690","data_version":"1.0.0","decided_at":"2026-07-15T00:03:58Z","decision":"approved_self_hosted","decision_reason_codes":["identity_rights_bytes_quality_closed"],"derivative_ids":["media-derivative:met-268690-320w-jpeg","media-derivative:met-268690-320w-webp","media-derivative:met-268690-640w-jpeg","media-derivative:met-268690-640w-webp","media-derivative:met-268690-960w-jpeg","media-derivative:met-268690-960w-webp","media-derivative:met-268690-1600w-jpeg","media-derivative:met-268690-1600w-webp"],"entity_type":"media_automated_review","executor":"automated_cross_validation_pipeline","human_review_dependency":false,"id":"media-review:met-268690","mandatory_closure":{"bytes":"pass","identity":"pass","quality":"pass","rights":"pass"},"phase_id":"MUSEUM-03C","quality_assessment_id":"media-quality:met-268690","schema_version":"1.0.0"},{"alternative_source_search_id":null,"artwork_id":"artwork:met-282043","branch_id":"art","byte_record_id":"media-byte:met-282043","cross_check_id":"media-cross-check:met-282043","data_version":"1.0.0","decided_at":"2026-07-15T00:03:58Z","decision":"approved_self_hosted","decision_reason_codes":["identity_rights_bytes_quality_closed"],"derivative_ids":["media-derivative:met-282043-320w-jpeg","media-derivative:met-282043-320w-webp","media-derivative:met-282043-640w-jpeg","media-derivative:met-282043-640w-webp","media-derivative:met-282043-960w-jpeg","media-derivative:met-282043-960w-webp","media-derivative:met-282043-1600w-jpeg","media-derivative:met-282043-1600w-webp"],"entity_type":"media_automated_review","executor":"automated_cross_validation_pipeline","human_review_dependency":false,"id":"media-review:met-282043","mandatory_closure":{"bytes":"pass","identity":"pass","quality":"pass","rights":"pass"},"phase_id":"MUSEUM-03C","quality_assessment_id":"media-quality:met-282043","schema_version":"1.0.0"},{"alternative_source_search_id":null,"artwork_id":"artwork:met-283099","branch_id":"art","byte_record_id":"media-byte:met-283099","cross_check_id":"media-cross-check:met-283099","data_version":"1.0.0","decided_at":"2026-07-15T00:03:58Z","decision":"approved_self_hosted","decision_reason_codes":["identity_rights_bytes_quality_closed"],"derivative_ids":["media-derivative:met-283099-320w-jpeg","media-derivative:met-283099-320w-webp","media-derivative:met-283099-640w-jpeg","media-derivative:met-283099-640w-webp","media-derivative:met-283099-960w-jpeg","media-derivative:met-283099-960w-webp"],"entity_type":"media_automated_review","executor":"automated_cross_validation_pipeline","human_review_dependency":false,"id":"media-review:met-283099","mandatory_closure":{"bytes":"pass","identity":"pass"